{
  "$schema": "https://json-schema.org/draft/2020-12/schema",
  "$id": "https://roundcraft.app/contracts/cases-response.json",
  "title": "Cases archive response",
  "type": "object",
  "additionalProperties": false,
  "required": ["ok", "data", "error", "meta"],
  "properties": {
    "ok": { "const": true },
    "data": {
      "type": "object",
      "additionalProperties": false,
      "required": ["editions"],
      "properties": {
        "editions": {
          "type": "array",
          "items": {
            "type": "object",
            "additionalProperties": false,
            "required": ["edition_id", "release_at", "metadata"],
            "properties": {
              "edition_id": {
                "type": "string",
                "pattern": "^[a-z0-9_]+$",
                "maxLength": 80
              },
              "release_at": {
                "type": "string",
                "pattern": "^\\d{4}-\\d{2}-\\d{2}T\\d{2}:\\d{2}:\\d{2}\\.\\d{3}Z$"
              },
              "metadata": {
                "type": "object"
              }
            }
          }
        },
        "next_cursor": {
          "type": ["string", "null"]
        }
      }
    },
    "error": { "type": "null" },
    "meta": {
      "type": "object",
      "additionalProperties": false,
      "required": ["request_id", "api_version"],
      "properties": {
        "request_id": {
          "type": "string",
          "pattern": "^[0-9a-f]{8}-[0-9a-f]{4}-[1-5][0-9a-f]{3}-[89ab][0-9a-f]{3}-[0-9a-f]{12}$"
        },
        "api_version": { "const": "v1" }
      }
    }
  }
}
