{
  "ok": true,
  "data": {
    "editions": [
      {
        "edition_id": "edition_2026_09_01",
        "release_at": "2026-09-01T00:00:00.000Z",
        "metadata": {
          "title": "Synthetic test edition"
        }
      }
    ],
    "next_cursor": null
  },
  "error": null,
  "meta": {
    "request_id": "c3d4e5f6-a7b8-4c9d-ae1f-a2b3c4d5e6f0",
    "api_version": "v1"
  }
}
